{
  "corpus_version": 1,
  "schema": "contracts/schema/corpus-v1.json",
  "protocol_schema": "contracts/schema/v1.json",
  "runner": {
    "default_bin": "./bin/sidecar",
    "env_bin": "SIDECAR_BIN",
    "cli_version_env": "SIDECAR_CLI_VERSION",
    "comparison": "byte-exact after approved template expansion",
    "template_version": 1,
    "templates": {
      "sha256:initial:PATH": "SHA-256 of initial regular file bytes",
      "sha256:final:PATH": "SHA-256 of expected final regular file bytes",
      "CLI_VERSION": "literal SIDECAR_CLI_VERSION",
      "UUIDV7:bind:NAME": "bind one runtime canonical lowercase UUIDv7 in an expected stream",
      "UUIDV7:ref:NAME": "refer to an earlier UUIDV7 binding in an expected stream or final regular-file bytes"
    }
  },
  "requirements": {
    "V1-IDX": {
      "source": "docs/v1/index.md",
      "subject": "target naming, normalized values, deterministic decisions"
    },
    "V1-PRO-ENV": {
      "source": "docs/v1/protocol.md",
      "subject": "envelopes and streams"
    },
    "V1-PRO-DTO": {
      "source": "docs/v1/protocol.md",
      "subject": "all DTOs and revisions"
    },
    "V1-PRO-APPLY": {
      "source": "docs/v1/protocol.md",
      "subject": "Apply request"
    },
    "V1-CLI-SURFACE": {
      "source": "docs/v1/cli.md",
      "subject": "all command surface/output"
    },
    "V1-CLI-INPUT": {
      "source": "docs/v1/cli.md",
      "subject": "inputs/stdin"
    },
    "V1-CLI-READ": {
      "source": "docs/v1/cli.md",
      "subject": "reads"
    },
    "V1-CLI-FORMAT": {
      "source": "docs/v1/cli.md",
      "subject": "format/fix"
    },
    "V1-CLI-MUTATE": {
      "source": "docs/v1/cli.md",
      "subject": "single mutations"
    },
    "V1-CLI-APPLY": {
      "source": "docs/v1/cli.md",
      "subject": "apply"
    },
    "V1-CLI-PRECEDENCE": {
      "source": "docs/v1/cli.md",
      "subject": "precedence"
    },
    "V1-FMT-GRAMMAR": {
      "source": "docs/v1/format.md",
      "subject": "grammar terminals/roles"
    },
    "V1-FMT-FRAMING": {
      "source": "docs/v1/format.md",
      "subject": "body framing"
    },
    "V1-FMT-META": {
      "source": "docs/v1/format.md",
      "subject": "metadata"
    },
    "V1-FMT-EMPTY": {
      "source": "docs/v1/format.md",
      "subject": "empty/noncanonical"
    },
    "V1-FMT-REPAIR": {
      "source": "docs/v1/format.md",
      "subject": "repair"
    },
    "V1-DOM-ID": {
      "source": "docs/v1/domain-and-unicode.md",
      "subject": "UUID"
    },
    "V1-DOM-AUTH": {
      "source": "docs/v1/domain-and-unicode.md",
      "subject": "authors/gitlab"
    },
    "V1-SRC-LOC": {
      "source": "docs/v1/source-and-location.md",
      "subject": "locations"
    },
    "V1-SRC-VAL": {
      "source": "docs/v1/source-and-location.md",
      "subject": "sources"
    },
    "V1-SRC-MUT": {
      "source": "docs/v1/source-and-location.md",
      "subject": "implicit source"
    },
    "V1-STORE-OBJECT": {
      "source": "docs/v1/storage-security.md",
      "subject": "secure objects"
    },
    "V1-STORE-TXN": {
      "source": "docs/v1/storage-security.md",
      "subject": "transaction"
    }
  },
  "fixtures": [
    {
      "id": "version-json",
      "golden": "contracts/goldens/v1/version-json.json",
      "requirements": [
        "V1-PRO-ENV",
        "V1-CLI-SURFACE"
      ],
      "coverage": [
        "BHV-PRO-VERSION-JSON-ENVELOPE"
      ]
    },
    {
      "id": "version-text",
      "golden": "contracts/goldens/v1/version-text.json",
      "requirements": [
        "V1-PRO-ENV",
        "V1-CLI-SURFACE"
      ],
      "coverage": [
        "BHV-CLI-VERSION-TEXT"
      ]
    },
    {
      "id": "validate-missing",
      "golden": "contracts/goldens/v1/validate-missing.json",
      "requirements": [
        "V1-CLI-READ",
        "V1-FMT-EMPTY",
        "V1-IDX"
      ],
      "coverage": [
        "BHV-READ-MISSING-VALIDATE"
      ]
    },
    {
      "id": "list-missing",
      "golden": "contracts/goldens/v1/list-missing.json",
      "requirements": [
        "V1-CLI-READ",
        "V1-PRO-DTO"
      ],
      "coverage": [
        "BHV-READ-MISSING-LIST"
      ]
    },
    {
      "id": "get-missing",
      "golden": "contracts/goldens/v1/get-missing.json",
      "requirements": [
        "V1-CLI-READ"
      ],
      "coverage": [
        "BHV-READ-MISSING-GET"
      ]
    },
    {
      "id": "zero-validate",
      "golden": "contracts/goldens/v1/zero-validate.json",
      "requirements": [
        "V1-FMT-EMPTY"
      ],
      "coverage": [
        "BHV-EMPTY-ZERO-VALIDATE"
      ]
    },
    {
      "id": "zero-format-check",
      "golden": "contracts/goldens/v1/zero-format-check.json",
      "requirements": [
        "V1-FMT-EMPTY",
        "V1-CLI-FORMAT"
      ],
      "coverage": [
        "BHV-EMPTY-ZERO-FORMAT-CHECK"
      ]
    },
    {
      "id": "zero-format",
      "golden": "contracts/goldens/v1/zero-format.json",
      "requirements": [
        "V1-FMT-EMPTY",
        "V1-STORE-TXN"
      ],
      "coverage": [
        "BHV-EMPTY-ZERO-FORMAT"
      ]
    },
    {
      "id": "target-no-suffix",
      "golden": "contracts/goldens/v1/target-no-suffix.json",
      "requirements": [
        "V1-IDX"
      ],
      "coverage": [
        "BHV-TARGET-NO-SUFFIX"
      ]
    },
    {
      "id": "target-dot",
      "golden": "contracts/goldens/v1/target-dot.json",
      "requirements": [
        "V1-IDX"
      ],
      "coverage": [
        "BHV-TARGET-DOT-NAME"
      ]
    },
    {
      "id": "target-temp",
      "golden": "contracts/goldens/v1/target-temp.json",
      "requirements": [
        "V1-IDX"
      ],
      "coverage": [
        "BHV-TARGET-TEMP-SUFFIX"
      ]
    },
    {
      "id": "canonical-validate",
      "golden": "contracts/goldens/v1/canonical-validate.json",
      "requirements": [
        "V1-FMT-GRAMMAR"
      ],
      "coverage": [
        "BHV-FORMAT-CANONICAL-VALIDATE"
      ]
    },
    {
      "id": "whitespace",
      "golden": "contracts/goldens/v1/whitespace.json",
      "requirements": [
        "V1-FMT-GRAMMAR",
        "V1-FMT-FRAMING"
      ],
      "coverage": [
        "BHV-FORMAT-WHITESPACE"
      ]
    },
    {
      "id": "bom",
      "golden": "contracts/goldens/v1/bom.json",
      "requirements": [
        "V1-FMT-GRAMMAR",
        "V1-FMT-FRAMING"
      ],
      "coverage": [
        "BHV-FORMAT-BOM"
      ]
    },
    {
      "id": "reserved",
      "golden": "contracts/goldens/v1/reserved.json",
      "requirements": [
        "V1-FMT-GRAMMAR",
        "V1-FMT-FRAMING"
      ],
      "coverage": [
        "BHV-FORMAT-RESERVED-PREFIX"
      ]
    },
    {
      "id": "bad-end",
      "golden": "contracts/goldens/v1/bad-end.json",
      "requirements": [
        "V1-FMT-GRAMMAR",
        "V1-FMT-FRAMING"
      ],
      "coverage": [
        "BHV-FORMAT-THREAD-END"
      ]
    },
    {
      "id": "meta-duplicate",
      "golden": "contracts/goldens/v1/meta-duplicate.json",
      "requirements": [
        "V1-FMT-META"
      ],
      "coverage": [
        "BHV-META-DUPLICATE-KEY"
      ]
    },
    {
      "id": "meta-unknown",
      "golden": "contracts/goldens/v1/meta-unknown.json",
      "requirements": [
        "V1-FMT-META"
      ],
      "coverage": [
        "BHV-META-UNKNOWN-KEY"
      ]
    },
    {
      "id": "meta-surrogate",
      "golden": "contracts/goldens/v1/meta-surrogate.json",
      "requirements": [
        "V1-FMT-META"
      ],
      "coverage": [
        "BHV-META-SURROGATE-ESCAPE"
      ]
    },
    {
      "id": "format-crlf",
      "golden": "contracts/goldens/v1/format-crlf.json",
      "requirements": [
        "V1-FMT-EMPTY",
        "V1-CLI-FORMAT"
      ],
      "coverage": [
        "BHV-FORMAT-CRLF-CANONICALIZE"
      ]
    },
    {
      "id": "repair-validate",
      "golden": "contracts/goldens/v1/repair-validate.json",
      "requirements": [
        "V1-FMT-REPAIR",
        "V1-PRO-DTO"
      ],
      "coverage": [
        "BHV-REPAIR-VALIDATE"
      ]
    },
    {
      "id": "repair-fix-check",
      "golden": "contracts/goldens/v1/repair-fix-check.json",
      "requirements": [
        "V1-FMT-REPAIR",
        "V1-CLI-FORMAT"
      ],
      "coverage": [
        "BHV-REPAIR-FIX-CHECK"
      ]
    },
    {
      "id": "source-anchor",
      "golden": "contracts/goldens/v1/source-anchor.json",
      "requirements": [
        "V1-SRC-LOC",
        "V1-SRC-VAL"
      ],
      "coverage": [
        "BHV-SOURCE-ANCHOR"
      ]
    },
    {
      "id": "source-bom",
      "golden": "contracts/goldens/v1/source-bom.json",
      "requirements": [
        "V1-SRC-VAL"
      ],
      "coverage": [
        "BHV-SOURCE-BOM"
      ]
    },
    {
      "id": "source-cr",
      "golden": "contracts/goldens/v1/source-cr.json",
      "requirements": [
        "V1-SRC-VAL"
      ],
      "coverage": [
        "BHV-SOURCE-BARE-CR"
      ]
    },
    {
      "id": "source-anchor-bad",
      "golden": "contracts/goldens/v1/source-anchor-bad.json",
      "requirements": [
        "V1-SRC-VAL"
      ],
      "coverage": [
        "BHV-SOURCE-ANCHOR-MISMATCH"
      ]
    },
    {
      "id": "thread-create",
      "golden": "contracts/goldens/v1/thread-create.json",
      "requirements": [
        "V1-CLI-SURFACE",
        "V1-CLI-MUTATE",
        "V1-SRC-MUT"
      ],
      "coverage": [
        "BHV-THREAD-CREATE"
      ]
    },
    {
      "id": "thread-move",
      "golden": "contracts/goldens/v1/thread-move.json",
      "requirements": [
        "V1-CLI-SURFACE",
        "V1-CLI-MUTATE"
      ],
      "coverage": [
        "BHV-THREAD-MOVE"
      ]
    },
    {
      "id": "message-add",
      "golden": "contracts/goldens/v1/message-add.json",
      "requirements": [
        "V1-CLI-SURFACE",
        "V1-CLI-MUTATE"
      ],
      "coverage": [
        "BHV-MESSAGE-ADD"
      ]
    },
    {
      "id": "message-update-noop",
      "golden": "contracts/goldens/v1/message-update-noop.json",